{
  "formatVersion": 1,
  "stage": {
    "width": 16,
    "height": 9
  },
  "background": "images/cutscene-camp.png",
  "backgroundColor": "#000000",
  "actors": [
    {
      "character": "player",
      "keyframes": [
        {
          "time": 0,
          "x": -1,
          "y": 8,
          "animation": "run"
        },
        {
          "time": 3,
          "x": 6,
          "y": 8,
          "animation": "idle"
        },
        {
          "time": 7,
          "x": 6,
          "y": 8
        }
      ]
    },
    {
      "character": "beetle",
      "facing": "left",
      "keyframes": [
        {
          "time": 4,
          "x": 17,
          "y": 8,
          "animation": "run"
        },
        {
          "time": 7,
          "x": 11,
          "y": 8
        }
      ]
    }
  ],
  "narration": [
    {
      "start": 0.5,
      "end": 3,
      "text": "Our hero escapes the jungle edge..."
    },
    {
      "start": 3,
      "end": 5,
      "text": "...and stops by the camp to rest."
    },
    {
      "start": 5,
      "end": 7.5,
      "text": "But a beetle is never far behind. Onward, to the ridge!"
    }
  ],
  "music": "audio/music/cutscene.ogg",
  "sounds": [
    {
      "time": 4,
      "sound": "audio/sounds/cutscene-crash.ogg"
    }
  ]
}
